{
  "assertions": [
    {
      "role": "fixture",
      "severity": "error",
      "type": "role_exists"
    },
    {
      "severity": "error",
      "type": "no_unreleased_inputs"
    },
    {
      "path": "telemetry.json",
      "severity": "error",
      "type": "output_exists"
    }
  ],
  "capture": {
    "audio": false,
    "background": "opaque",
    "contact_sheet_ticks": [
      1,
      4,
      7,
      10,
      13,
      16
    ],
    "end_tick": 19,
    "fps": 60,
    "height": 720,
    "required_keyframes": true,
    "start_tick": 0,
    "width": 1280
  },
  "description": "Tiny rendered fixture proving sparse evidence keyframes cannot wedge on an unscheduled post-draw signal.",
  "duration_ticks": 20,
  "id": "validation/evidence_capture",
  "probes": [],
  "scene": "res://tools/validation/fixtures/moment_forge_probe.tscn",
  "schema_version": 1,
  "seed": 104729,
  "setup": {
    "fixture": {
      "config": {},
      "id": "evidence_capture"
    },
    "processing": [],
    "properties": [],
    "remove_nodes": [],
    "roles": {
      "fixture": {
        "node_path": "."
      }
    },
    "spawns": []
  },
  "simulation": {
    "max_wall_seconds": 5,
    "pause_during_setup": true,
    "physics_hz": 60,
    "warmup_ticks": 1
  },
  "stable_fingerprint": {
    "counters": [],
    "event_payload_fields": {},
    "float_quantum": 0.0001,
    "position_quantum_px": 0.25,
    "probes": []
  },
  "tags": [
    "validation",
    "moment",
    "capture"
  ],
  "timeline": [
    {
      "action": "finish",
      "tick": 18
    }
  ]
}
